{
  "$schema": "https://json-schema.org/draft/2020-12/schema",
  "title": "WorldState",
  "type": "object",
  "additionalProperties": false,
  "required": ["run_id", "sequence_no", "state_hash", "entities", "reduced_at"],
  "properties": {
    "run_id": {"type": "string"},
    "sequence_no": {"type": "integer", "minimum": 0},
    "state_hash": {"type": "string", "pattern": "^[0-9a-f]{64}$"},
    "entities": {
      "type": "array",
      "items": {
        "type": "object",
        "additionalProperties": false,
        "required": ["entity_id", "entity_type", "belief"],
        "properties": {
          "entity_id": {"type": "string"},
          "entity_type": {"type": "string"},
          "pose": {"$ref": "pose.schema.json"},
          "belief": {"enum": ["observed", "inferred", "stale", "lost"]},
          "confidence": {"type": "number", "minimum": 0, "maximum": 1},
          "last_observed_at": {"type": ["string", "null"]},
          "evidence_refs": {"type": "array", "items": {"type": "string"}},
          "attributes": {
            "type": "object",
            "description": "Finite observed attributes. Keys use the bounded vocabulary; canonical UTF-8 JSON is limited to 4096 bytes.",
            "maxProperties": 32,
            "additionalProperties": false,
            "properties": {
              "barcode": {"type": "string", "minLength": 1, "maxLength": 256, "pattern": "^[^\\u0000-\\u001f\\u007f-\\u009f]+$"},
              "colour": {"type": "string", "minLength": 1, "maxLength": 256, "pattern": "^[^\\u0000-\\u001f\\u007f-\\u009f]+$"},
              "condition": {"type": "string", "minLength": 1, "maxLength": 256, "pattern": "^[^\\u0000-\\u001f\\u007f-\\u009f]+$", "enum": ["damaged", "intact", "unknown"]},
              "door_state": {"type": "string", "minLength": 1, "maxLength": 256, "pattern": "^[^\\u0000-\\u001f\\u007f-\\u009f]+$", "enum": ["closed", "open", "unknown"]},
              "identity": {"type": "string", "minLength": 1, "maxLength": 256, "pattern": "^[^\\u0000-\\u001f\\u007f-\\u009f]+$"},
              "label_status": {"type": "string", "minLength": 1, "maxLength": 256, "pattern": "^[^\\u0000-\\u001f\\u007f-\\u009f]+$", "enum": ["missing", "unknown", "unreadable", "verified"]},
              "orientation": {"type": "string", "minLength": 1, "maxLength": 256, "pattern": "^[^\\u0000-\\u001f\\u007f-\\u009f]+$"},
              "parcel_uid": {"type": "string", "minLength": 1, "maxLength": 256, "pattern": "^[^\\u0000-\\u001f\\u007f-\\u009f]+$"},
              "presence": {"type": "string", "minLength": 1, "maxLength": 256, "pattern": "^[^\\u0000-\\u001f\\u007f-\\u009f]+$", "enum": ["absent", "present", "unknown"]},
              "rack_state": {"type": "string", "minLength": 1, "maxLength": 256, "pattern": "^[^\\u0000-\\u001f\\u007f-\\u009f]+$", "enum": ["closed", "open", "unknown"]},
              "slot_occupancy": {"type": "string", "minLength": 1, "maxLength": 256, "pattern": "^[^\\u0000-\\u001f\\u007f-\\u009f]+$", "enum": ["blocked", "empty", "occupied", "unknown"]},
              "slot_state": {"type": "string", "minLength": 1, "maxLength": 256, "pattern": "^[^\\u0000-\\u001f\\u007f-\\u009f]+$", "enum": ["blocked", "empty", "occupied", "unknown"]},
              "tracking_id": {"type": "string", "minLength": 1, "maxLength": 256, "pattern": "^[^\\u0000-\\u001f\\u007f-\\u009f]+$"}
            }
          },
          "attributes_schema_version": {"type": "string", "enum": ["observed-attributes-v1", "legacy-observed-attributes-v0"]},
          "attribute_metadata": {
            "type": "object",
            "description": "Per-attribute timestamp, confidence, belief, source and evidence metadata. Canonical UTF-8 JSON is limited to 16384 bytes.",
            "maxProperties": 32,
            "additionalProperties": false,
            "properties": {
              "barcode": {"type":"object","additionalProperties":false,"required":["observed_at","confidence","evidence_refs","belief"],"properties":{"observed_at":{"type":"string","minLength":1,"maxLength":256,"pattern":"^[^\\u0000-\\u001f\\u007f-\\u009f]+$"},"confidence":{"type":"number","minimum":0,"maximum":1},"evidence_refs":{"type":"array","minItems":1,"maxItems":32,"items":{"type":"string","minLength":1,"maxLength":256,"pattern":"^[^\\u0000-\\u001f\\u007f-\\u009f]+$"}},"belief":{"type":"string","enum":["inferred","lost","observed","stale"]},"clock_id":{"type":"string","enum":["monotonic","wall"]},"source":{"type":"string","minLength":1,"maxLength":256,"pattern":"^[^\\u0000-\\u001f\\u007f-\\u009f]+$"}}},
              "colour": {"type":"object","additionalProperties":false,"required":["observed_at","confidence","evidence_refs","belief"],"properties":{"observed_at":{"type":"string","minLength":1,"maxLength":256,"pattern":"^[^\\u0000-\\u001f\\u007f-\\u009f]+$"},"confidence":{"type":"number","minimum":0,"maximum":1},"evidence_refs":{"type":"array","minItems":1,"maxItems":32,"items":{"type":"string","minLength":1,"maxLength":256,"pattern":"^[^\\u0000-\\u001f\\u007f-\\u009f]+$"}},"belief":{"type":"string","enum":["inferred","lost","observed","stale"]},"clock_id":{"type":"string","enum":["monotonic","wall"]},"source":{"type":"string","minLength":1,"maxLength":256,"pattern":"^[^\\u0000-\\u001f\\u007f-\\u009f]+$"}}},
              "condition": {"type":"object","additionalProperties":false,"required":["observed_at","confidence","evidence_refs","belief"],"properties":{"observed_at":{"type":"string","minLength":1,"maxLength":256,"pattern":"^[^\\u0000-\\u001f\\u007f-\\u009f]+$"},"confidence":{"type":"number","minimum":0,"maximum":1},"evidence_refs":{"type":"array","minItems":1,"maxItems":32,"items":{"type":"string","minLength":1,"maxLength":256,"pattern":"^[^\\u0000-\\u001f\\u007f-\\u009f]+$"}},"belief":{"type":"string","enum":["inferred","lost","observed","stale"]},"clock_id":{"type":"string","enum":["monotonic","wall"]},"source":{"type":"string","minLength":1,"maxLength":256,"pattern":"^[^\\u0000-\\u001f\\u007f-\\u009f]+$"}}},
              "door_state": {"type":"object","additionalProperties":false,"required":["observed_at","confidence","evidence_refs","belief"],"properties":{"observed_at":{"type":"string","minLength":1,"maxLength":256,"pattern":"^[^\\u0000-\\u001f\\u007f-\\u009f]+$"},"confidence":{"type":"number","minimum":0,"maximum":1},"evidence_refs":{"type":"array","minItems":1,"maxItems":32,"items":{"type":"string","minLength":1,"maxLength":256,"pattern":"^[^\\u0000-\\u001f\\u007f-\\u009f]+$"}},"belief":{"type":"string","enum":["inferred","lost","observed","stale"]},"clock_id":{"type":"string","enum":["monotonic","wall"]},"source":{"type":"string","minLength":1,"maxLength":256,"pattern":"^[^\\u0000-\\u001f\\u007f-\\u009f]+$"}}},
              "identity": {"type":"object","additionalProperties":false,"required":["observed_at","confidence","evidence_refs","belief"],"properties":{"observed_at":{"type":"string","minLength":1,"maxLength":256,"pattern":"^[^\\u0000-\\u001f\\u007f-\\u009f]+$"},"confidence":{"type":"number","minimum":0,"maximum":1},"evidence_refs":{"type":"array","minItems":1,"maxItems":32,"items":{"type":"string","minLength":1,"maxLength":256,"pattern":"^[^\\u0000-\\u001f\\u007f-\\u009f]+$"}},"belief":{"type":"string","enum":["inferred","lost","observed","stale"]},"clock_id":{"type":"string","enum":["monotonic","wall"]},"source":{"type":"string","minLength":1,"maxLength":256,"pattern":"^[^\\u0000-\\u001f\\u007f-\\u009f]+$"}}},
              "label_status": {"type":"object","additionalProperties":false,"required":["observed_at","confidence","evidence_refs","belief"],"properties":{"observed_at":{"type":"string","minLength":1,"maxLength":256,"pattern":"^[^\\u0000-\\u001f\\u007f-\\u009f]+$"},"confidence":{"type":"number","minimum":0,"maximum":1},"evidence_refs":{"type":"array","minItems":1,"maxItems":32,"items":{"type":"string","minLength":1,"maxLength":256,"pattern":"^[^\\u0000-\\u001f\\u007f-\\u009f]+$"}},"belief":{"type":"string","enum":["inferred","lost","observed","stale"]},"clock_id":{"type":"string","enum":["monotonic","wall"]},"source":{"type":"string","minLength":1,"maxLength":256,"pattern":"^[^\\u0000-\\u001f\\u007f-\\u009f]+$"}}},
              "orientation": {"type":"object","additionalProperties":false,"required":["observed_at","confidence","evidence_refs","belief"],"properties":{"observed_at":{"type":"string","minLength":1,"maxLength":256,"pattern":"^[^\\u0000-\\u001f\\u007f-\\u009f]+$"},"confidence":{"type":"number","minimum":0,"maximum":1},"evidence_refs":{"type":"array","minItems":1,"maxItems":32,"items":{"type":"string","minLength":1,"maxLength":256,"pattern":"^[^\\u0000-\\u001f\\u007f-\\u009f]+$"}},"belief":{"type":"string","enum":["inferred","lost","observed","stale"]},"clock_id":{"type":"string","enum":["monotonic","wall"]},"source":{"type":"string","minLength":1,"maxLength":256,"pattern":"^[^\\u0000-\\u001f\\u007f-\\u009f]+$"}}},
              "parcel_uid": {"type":"object","additionalProperties":false,"required":["observed_at","confidence","evidence_refs","belief"],"properties":{"observed_at":{"type":"string","minLength":1,"maxLength":256,"pattern":"^[^\\u0000-\\u001f\\u007f-\\u009f]+$"},"confidence":{"type":"number","minimum":0,"maximum":1},"evidence_refs":{"type":"array","minItems":1,"maxItems":32,"items":{"type":"string","minLength":1,"maxLength":256,"pattern":"^[^\\u0000-\\u001f\\u007f-\\u009f]+$"}},"belief":{"type":"string","enum":["inferred","lost","observed","stale"]},"clock_id":{"type":"string","enum":["monotonic","wall"]},"source":{"type":"string","minLength":1,"maxLength":256,"pattern":"^[^\\u0000-\\u001f\\u007f-\\u009f]+$"}}},
              "presence": {"type":"object","additionalProperties":false,"required":["observed_at","confidence","evidence_refs","belief"],"properties":{"observed_at":{"type":"string","minLength":1,"maxLength":256,"pattern":"^[^\\u0000-\\u001f\\u007f-\\u009f]+$"},"confidence":{"type":"number","minimum":0,"maximum":1},"evidence_refs":{"type":"array","minItems":1,"maxItems":32,"items":{"type":"string","minLength":1,"maxLength":256,"pattern":"^[^\\u0000-\\u001f\\u007f-\\u009f]+$"}},"belief":{"type":"string","enum":["inferred","lost","observed","stale"]},"clock_id":{"type":"string","enum":["monotonic","wall"]},"source":{"type":"string","minLength":1,"maxLength":256,"pattern":"^[^\\u0000-\\u001f\\u007f-\\u009f]+$"}}},
              "rack_state": {"type":"object","additionalProperties":false,"required":["observed_at","confidence","evidence_refs","belief"],"properties":{"observed_at":{"type":"string","minLength":1,"maxLength":256,"pattern":"^[^\\u0000-\\u001f\\u007f-\\u009f]+$"},"confidence":{"type":"number","minimum":0,"maximum":1},"evidence_refs":{"type":"array","minItems":1,"maxItems":32,"items":{"type":"string","minLength":1,"maxLength":256,"pattern":"^[^\\u0000-\\u001f\\u007f-\\u009f]+$"}},"belief":{"type":"string","enum":["inferred","lost","observed","stale"]},"clock_id":{"type":"string","enum":["monotonic","wall"]},"source":{"type":"string","minLength":1,"maxLength":256,"pattern":"^[^\\u0000-\\u001f\\u007f-\\u009f]+$"}}},
              "slot_occupancy": {"type":"object","additionalProperties":false,"required":["observed_at","confidence","evidence_refs","belief"],"properties":{"observed_at":{"type":"string","minLength":1,"maxLength":256,"pattern":"^[^\\u0000-\\u001f\\u007f-\\u009f]+$"},"confidence":{"type":"number","minimum":0,"maximum":1},"evidence_refs":{"type":"array","minItems":1,"maxItems":32,"items":{"type":"string","minLength":1,"maxLength":256,"pattern":"^[^\\u0000-\\u001f\\u007f-\\u009f]+$"}},"belief":{"type":"string","enum":["inferred","lost","observed","stale"]},"clock_id":{"type":"string","enum":["monotonic","wall"]},"source":{"type":"string","minLength":1,"maxLength":256,"pattern":"^[^\\u0000-\\u001f\\u007f-\\u009f]+$"}}},
              "slot_state": {"type":"object","additionalProperties":false,"required":["observed_at","confidence","evidence_refs","belief"],"properties":{"observed_at":{"type":"string","minLength":1,"maxLength":256,"pattern":"^[^\\u0000-\\u001f\\u007f-\\u009f]+$"},"confidence":{"type":"number","minimum":0,"maximum":1},"evidence_refs":{"type":"array","minItems":1,"maxItems":32,"items":{"type":"string","minLength":1,"maxLength":256,"pattern":"^[^\\u0000-\\u001f\\u007f-\\u009f]+$"}},"belief":{"type":"string","enum":["inferred","lost","observed","stale"]},"clock_id":{"type":"string","enum":["monotonic","wall"]},"source":{"type":"string","minLength":1,"maxLength":256,"pattern":"^[^\\u0000-\\u001f\\u007f-\\u009f]+$"}}},
              "tracking_id": {"type":"object","additionalProperties":false,"required":["observed_at","confidence","evidence_refs","belief"],"properties":{"observed_at":{"type":"string","minLength":1,"maxLength":256,"pattern":"^[^\\u0000-\\u001f\\u007f-\\u009f]+$"},"confidence":{"type":"number","minimum":0,"maximum":1},"evidence_refs":{"type":"array","minItems":1,"maxItems":32,"items":{"type":"string","minLength":1,"maxLength":256,"pattern":"^[^\\u0000-\\u001f\\u007f-\\u009f]+$"}},"belief":{"type":"string","enum":["inferred","lost","observed","stale"]},"clock_id":{"type":"string","enum":["monotonic","wall"]},"source":{"type":"string","minLength":1,"maxLength":256,"pattern":"^[^\\u0000-\\u001f\\u007f-\\u009f]+$"}}}
            }
          }
        },
        "allOf": [
          {"if": {"required": ["attributes"]}, "then": {"required": ["attributes_schema_version"]}},
          {"if": {"required": ["attributes_schema_version"]}, "then": {"required": ["attributes"]}},
          {"if": {"required": ["attribute_metadata"]}, "then": {"required": ["attributes"]}},
          {
            "if": {
              "required": ["attributes_schema_version"],
              "properties": {"attributes_schema_version": {"const": "observed-attributes-v1"}}
            },
            "then": {"required": ["attribute_metadata"]}
          }
        ]
      }
    },
    "relations": {
      "type": "array",
      "items": {
        "type": "object",
        "additionalProperties": false,
        "required": ["subject_id", "predicate", "object_id", "belief"],
        "properties": {
          "subject_id": {"type": "string"},
          "predicate": {"enum": ["inside", "on_top_of", "held_by", "adjacent_to"]},
          "object_id": {"type": "string"},
          "belief": {"enum": ["observed", "inferred", "stale", "lost"]},
          "evidence_refs": {"type": "array", "items": {"type": "string"}}
        }
      }
    },
    "reduced_at": {"type": "string"},
    "clock_id": {"enum": ["monotonic", "wall"]}
  }
}
